<!DOCTYPE class SYSTEM "../../../../../../../../lib/tools/dtd/GalleryClass2.0.dtd">
<class>
<class-name>QuotasMap</class-name>
<schema>
<schema-name>QuotasMap</schema-name>
<schema-major>1</schema-major>
<schema-minor>0</schema-minor>
</schema>
<map>
<member>
<member-name>userOrGroupId</member-name>
<member-type>INTEGER</member-type>
</member>
<member>
<member-name>quotaSize</member-name>
<member-type>INTEGER</member-type>
<required/>
</member>
<index>
<member-name>userOrGroupId</member-name>
</index>
</map>
</class>
